Symbol,Name,Last Sale,Net Change,% Change,Market Cap,Country,IPO Year,Volume,Sector,Industry
PFE,Pfizer Inc. Common Stock,$58.71,-0.84,-1.411%,329531397969.00,United States,,39160702,Health Care,Biotechnology: Pharmaceutical Preparations
PFGC,Performance Food Group Company Common Stock,$45.16,0.75,1.689%,6968850046.00,United States,2015,905374,Consumer Non-Durables,Food Distributors
PFH,Prudential Financial Inc. 4.125% Junior Subordinated Notes due 2060,$26.01,-0.04,-0.154%,0.00,United States,2020,39992,,
PFL,PIMCO Income Strategy Fund Shares of Beneficial Interest,$10.93,0.13,1.204%,374691330.00,United States,2003,149765,Finance,Finance Companies
PFN,PIMCO Income Strategy Fund II,$9.52,0.12,1.277%,731669120.00,United States,2004,341078,Finance,Finance/Investors Services
PFO,Flaherty & Crumrine Preferred and Income Opportunity Fund Incorporated,$12.46,0.03,0.241%,159658852.00,United States,1992,22058,Finance,Finance Companies
PFS,Provident Financial Services Inc Common Stock,$24.29,0.20,0.83%,1879431001.00,United States,2003,124383,Finance,Savings Institutions
PFSI,PennyMac Financial Services Inc. Common Stock,$69.96,0.54,0.778%,4129683532.00,United States,2013,288699,Finance,Finance: Consumer Services
PG,Procter & Gamble Company (The) Common Stock,$160.10,0.78,0.49%,387433645822.00,United States,,5640934,Consumer Non-Durables,Package Goods/Cosmetics
PGP,Pimco Global Stocksplus & Income Fund Pimco Global StocksPlus & Income Fund Common Shares of Beneficial Interest,$10.74,0.13,1.225%,119106600.00,United States,2005,43136,Finance,Finance Companies
PGR,Progressive Corporation (The) Common Stock,$101.25,0.09,0.089%,59170500000.00,United States,,2133269,Finance,Property-Casualty Insurers
PGRE,Paramount Group Inc. Common Stock,$8.49,0.08,0.951%,1858939887.00,United States,2014,775525,Consumer Services,Real Estate Investment Trusts
PGSS,Pegasus Digital Mobility Acquisition Corp. Class A Ordinary Shares,$9.87,-0.014,-0.142%,278827500.00,,2021,10341,,
PGTI,PGT Innovations Inc.,$22.32,0.12,0.541%,1330890219.00,United States,2006,92440,Capital Goods,Building Products
PGZ,Principal Real Estate Income Fund Common Shares of Beneficial Interest,$15.35,0.07,0.458%,104578353.00,,2013,24119,Finance,Investment Managers
PH,Parker-Hannifin Corporation Common Stock,$311.89,5.41,1.765%,40082528691.00,United States,,633153,Capital Goods,Office Equipment/Supplies/Services
PHD,Pioneer Floating Rate Fund Inc.,$12.06,0.02,0.166%,149185444.00,United States,2004,55264,Finance,Investment Managers
PHG,Koninklijke Philips N.V. NY Registry Shares,$36.30,0.72,2.024%,33044107800.00,Netherlands,,1191228,Health Care,Biotechnology: Electromedical & Electrotherapeutic Apparatus
PHI,PLDT Inc. Sponsored ADR,$37.02,0.12,0.325%,7996320000.00,Philippines,,21325,Public Utilities,Telecommunications Equipment
PHK,Pimco High Income Fund Pimco High Income Fund,$6.13,0.07,1.155%,820831520.00,United States,2003,954678,Finance,Finance/Investors Services
PHM,PulteGroup Inc. Common Stock,$54.65,0.11,0.202%,13836596702.00,United States,,1080100,,
PHR,Phreesia Inc. Common Stock,$44.23,1.70,3.997%,2266339008.00,United States,2019,531030,Health Care,Managed Health Care
PHT,Pioneer High Income Fund Inc.,$9.41,0.11,1.183%,275700061.00,United States,,77246,Finance,Investment Managers
PHX,PHX Minerals Inc. Common Stock,$2.17,-0.01,-0.459%,71546677.00,United States,,210278,Energy,Oil & Gas Production
PHYT,Pyrophyte Acquisition Corp. Class A Ordinary Shares,$9.85,-0.05,-0.505%,247789063.00,,2021,198200,,
PIAI,Prime Impact Acquisition I Class A Ordinary Shares,$9.79,0.00,0.00%,396597961.00,,2020,10299,Finance,Business Services
PICC,Pivotal Investment Corporation III Class A Common Stock,$9.76,0.04,0.412%,336720000.00,,2021,141690,,
PII,Polaris Inc. Common Stock,$106.27,1.02,0.969%,6448650741.00,United States,,389252,Consumer Non-Durables,Recreational Products/Toys
PIM,Putnam Master Intermediate Income Trust Common Stock,$3.89,0.02,0.517%,199116212.00,United States,1988,227407,Finance,Finance Companies
PINE,Alpine Income Property Trust Inc. Common Stock,$19.11,0.13,0.685%,216003044.00,United States,2019,42051,Consumer Services,Real Estate Investment Trusts
PING,Ping Identity Holding Corp. Common Stock,$23.30,-0.03,-0.129%,1947473438.00,United States,2019,371102,Technology,EDP Services
PINS,Pinterest Inc. Class A Common Stock,$37.42,0.16,0.429%,24405193105.00,,2019,6255613,,
PIPP,Pine Island Acquisition Corp. Class A Common Stock,$9.86,-0.02,-0.202%,269163210.00,United States,2021,129069,,
PIPR,Piper Sandler Companies Common Stock,$180.09,2.22,1.248%,3219684138.00,United States,,42735,Finance,Investment Bankers/Brokers/Service
PJT,PJT Partners Inc. Class A Common Stock,$74.95,0.69,0.929%,1818864565.00,United States,2015,83403,Finance,Investment Managers
PK,Park Hotels & Resorts Inc. Common Stock ,$19.29,0.14,0.731%,4561683363.00,United States,2016,1563992,Consumer Services,Real Estate Investment Trusts
PKE,Park Aerospace Corp. Common Stock,$13.23,0.15,1.147%,270662118.00,United States,,77174,,
PKG,Packaging Corporation of America Common Stock,$131.30,0.31,0.237%,12472287576.00,United States,2000,453242,Basic Industries,Paper
PKI,PerkinElmer Inc. Common Stock,$193.77,2.26,1.18%,24453811204.00,United States,,622313,Health Care,Medical Specialities
PKX,POSCO Common Stock,$60.14,0.11,0.183%,18192487600.00,South Korea,1994,178870,Basic Industries,Steel/Iron Ore
PL,Planet Labs PBC Class A Common Stock,$7.11,0.76,11.969%,1867799588.00,,2021,5282154,Capital Goods,Aerospace
PLAN,Anaplan Inc. Common Stock,$46.12,0.63,1.385%,6810154007.00,United States,2018,1443494,Technology,Computer Software: Prepackaged Software
PLD,Prologis Inc. Common Stock,$161.75,-0.51,-0.314%,119586142250.00,United States,,3047842,Consumer Services,Real Estate Investment Trusts
PLNT,Planet Fitness Inc. Common Stock,$90.97,1.66,1.859%,7581854987.00,United States,2015,602930,Consumer Services,Other Consumer Services
PLOW,Douglas Dynamics Inc. Common Stock,$38.65,0.99,2.629%,888213756.00,United States,2010,57561,Capital Goods,Construction/Ag Equipment/Trucks
PLTR,Palantir Technologies Inc. Class A Common Stock,$18.93,0.05,0.265%,37951260205.00,,2020,24698092,Technology,Retail: Computer Software & Peripheral Equipment
PLYM,Plymouth Industrial REIT Inc. Common Stock,$30.19,-0.15,-0.494%,1044738807.00,United States,2017,207439,Consumer Services,Real Estate Investment Trusts
PM,Philip Morris International Inc Common Stock,$92.93,0.02,0.022%,144675996302.00,United States,,2924377,Consumer Non-Durables,Farming/Seeds/Milling
PMF,PIMCO Municipal Income Fund Common Stock,$14.90,0.29,1.985%,387591018.00,United States,2001,71921,Finance,Finance/Investors Services
PML,Pimco Municipal Income Fund II Common Shares of Beneficial Interest,$14.59,0.02,0.137%,922942974.00,United States,2002,64626,Finance,Investment Managers
PMM,Putnam Managed Municipal Income Trust Common Stock,$8.89,0.05,0.566%,434625601.00,United States,1989,47752,Finance,Investment Managers
PMO,Putnam Municipal Opportunities Trust Common Stock,$14.88,0.05,0.337%,507552128.00,United States,1993,43711,Finance,Finance Companies
PMT,PennyMac Mortgage Investment Trust Common Shares of Beneficial Interest,$17.83,0.19,1.077%,1729629354.00,United States,2009,682586,Consumer Services,Real Estate Investment Trusts
PMT^A,PennyMac Mortgage Investment Trust 8.125% Series A Fixed-to-Floating Rate Cumulative Redeemable Preferred Shares of Beneficial Interest,$25.91,0.00,0.00%,,United States,,1291,,
PMT^B,PennyMac Mortgage Investment Trust 8.00% Series B Fixed-to-Floating Rate Cumulative Redeemable Preferred Shares of Beneficial Interest,$25.64,-0.05,-0.195%,,United States,,2548,,
PMT^C,PennyMac Mortgage Investment Trust 6.75% Series C Cumulative Redeemable Preferred Shares of Beneficial Interest,$24.91,-0.09,-0.36%,,United States,,26563,,
PMVC,PMV Consumer Acquisition Corp. Class A Common Stock,$9.81,0.01,0.102%,214593750.00,United States,2020,15512,,
PMX,PIMCO Municipal Income Fund III Common Shares of Beneficial Interest,$12.73,0.2401,1.922%,423114355.00,United States,2002,43275,Finance,Trusts Except Educational Religious and Charitable
PNC,PNC Financial Services Group Inc. (The) Common Stock,$197.93,0.81,0.411%,83653294930.00,United States,,707829,Finance,Major Banks
PNC^P,PNC Financial Services Group Inc. (The) Depositary Shares Representing 1/4000th Perpetual Preferred Series P,$25.605,0.005,0.02%,,United States,,112160,,
PNF,PIMCO New York Municipal Income Fund Common Stock,$12.24,0.08,0.658%,96052849.00,United States,2001,4464,Finance,Finance Companies
PNI,Pimco New York Municipal Income Fund II Common Shares of Beneficial Interest,$11.22,-0.01,-0.089%,125701565.00,United States,2002,31557,Finance,Trusts Except Educational Religious and Charitable
PNM,PNM Resources Inc. (Holding Co.) Common Stock,$45.07,0.10,0.222%,3868577771.00,United States,,1785620,Public Utilities,Electric Utilities: Central
PNR,Pentair plc. Ordinary Share,$71.22,1.20,1.714%,11785358757.00,Switzerland,,711861,Capital Goods,Fluid Controls
PNTM,Pontem Corporation Class A Ordinary Shares,$9.80,-0.01,-0.102%,845250000.00,,2021,78807,Finance,Business Services
PNW,Pinnacle West Capital Corporation Common Stock,$68.91,0.36,0.525%,7774345093.00,United States,,1058810,Public Utilities,Electric Utilities: Central
POLY,Plantronics Inc. Common Stock,$29.41,0.28,0.961%,1256735150.00,United States,,206461,Public Utilities,Telecommunications Equipment
POR,Portland General Electric Co Common Stock,$51.32,-0.77,-1.478%,4588501339.00,United States,,387263,Public Utilities,Electric Utilities: Central
POST,Post Holdings Inc. Common Stock,$107.06,0.66,0.62%,6698065333.00,United States,2012,200450,Consumer Non-Durables,Food Distributors
PPG,PPG Industries Inc. Common Stock,$167.06,1.32,0.796%,39660186502.00,United States,,709123,Basic Industries,Paints/Coatings
PPL,PPL Corporation Common Stock,$29.42,0.01,0.034%,22086061837.00,United States,,2280858,Public Utilities,Electric Utilities: Central
PPT,Putnam Premier Income Trust Common Stock,$4.29,0.04,0.941%,438490093.00,United States,1988,425666,Finance,Finance Companies
PRA,ProAssurance Corporation Common Stock,$24.36,0.49,2.053%,1315039546.00,United States,,133448,Finance,Property-Casualty Insurers
PRBM,Parabellum Acquisition Corp. Class A Common Stock,$9.75,0.00,0.00%,47865334.00,,2021,4933,,
PRE^J,PartnerRe Ltd. 4.875% Fixed Rate Non-Cumulative Redeemable Preferred Shares Series J,$26.855,-0.045,-0.167%,,Bermuda,,11989,,
PRG,PROG Holdings Inc. Common Stock,$45.04,0.27,0.603%,2945223476.00,United States,,345293,Technology,Diversified Commercial Services
PRGO,Perrigo Company plc Ordinary Shares,$39.54,0.23,0.585%,5289419255.00,United States,,874963,Health Care,Biotechnology: Pharmaceutical Preparations
PRI,Primerica Inc. Common Stock,$153.57,2.60,1.722%,6064457186.00,United States,2010,102134,Finance,Life Insurance
PRIF^D,Priority Income Fund Inc. 7.00% Series D Term Preferred Stock due 2029,$25.2301,0.0601,0.239%,,,,600,,
PRIF^F,Priority Income Fund Inc. 6.625% Series F Term Preferred Stock due 2027,$25.35,0.03,0.118%,,,,2080,,
PRIF^G,Priority Income Fund Inc. 6.25% Series G Preferred Stock Due 2026,$26.16,0.59,2.307%,,,,600,,
PRIF^H,Priority Income Fund Inc. 6.00% Series H Term Preferred Stock due 2026,$25.15,0.00,0.00%,,,,2285,,
PRIF^I,Priority Income Fund Inc. 6.125% Series I Term Preferred Stock due 2028,$25.26,0.105,0.417%,,,,6068,,
PRIF^J,Priority Income Fund Inc. 6.000% Series J Term Preferred Stock due 2028,$24.94,-0.0505,-0.202%,,,,3706,,
PRIF^K,Priority Income Fund Inc. 7.000% Series K Cumulative Preferred Stock,$24.52,-0.03,-0.122%,,,,7960,,
PRLB,Proto Labs Inc. Common stock,$52.76,0.73,1.403%,1455629881.00,United States,2012,320358,Capital Goods,Office Equipment/Supplies/Services
PRM,Perimeter Solutions SA Ordinary Shares,$14.00,1.15,8.949%,2199926890.00,,2021,291574,,
PRMW,Primo Water Corporation Common Stock,$17.47,0.09,0.518%,2796924761.00,Canada,,331098,Consumer Non-Durables,Soft Drinks
PRO,PROS Holdings Inc. Common Stock,$35.60,0.08,0.225%,1580359792.00,United States,2007,139060,Technology,EDP Services
PRPB,CC Neuberger Principal Holdings II Class A Ordinary Shares,$9.86,0.01,0.102%,1069810000.00,United States,2020,254128,Finance,Business Services
PRPC,CC Neuberger Principal Holdings III Class A Ordinary Shares,$9.81,0.01,0.102%,542615625.00,,2021,372,Finance,Business Services
PRS,Prudential Financial Inc. 5.625% Junior Subordinated Notes due 2058,$26.72,-0.04,-0.149%,910125070.00,United States,2018,14117,Finance,Investment Bankers/Brokers/Service
PRT,PermRock Royalty Trust Trust Units,$6.80,0.00,0.00%,82726978.00,United States,2018,49159,Energy,Oil & Gas Production
PRTY,Party City Holdco Inc. Common Stock,$5.64,0.10,1.805%,632951160.00,United States,2015,1633617,Miscellaneous,Diversified Commercial Services
PRU,Prudential Financial Inc. Common Stock,$108.25,1.34,1.253%,40918500000.00,United States,2001,1222403,Finance,Life Insurance
PSA,Public Storage Common Stock,$362.45,-2.98,-0.815%,63557260272.00,United States,,530219,Consumer Services,Real Estate Investment Trusts
PSA^E,Public Storage Depositary Shares Each Representing 1/1000 of a 4.90% Cumulative Preferred Share of Beneficial Interest Series E,$24.995,-0.005,-0.02%,,United States,,5219,,
PSA^F,Public Storage Depositary Shares Each Representing 1/1000 of a 5.15% Cumulative Preferred Share of Beneficial Interest Series F par value $0.01 per share,$25.34,-0.03,-0.118%,,United States,,15871,,
PSA^G,Public Storage Depositary Shares Each Representing 1/1000 of a 5.05% Cumulative Preferred Share of Beneficial Interest Series G,$25.45,-0.03,-0.118%,,United States,,6579,,
PSA^H,Public Storage Depositary Shares Each Representing 1/1000 of a  5.60% Cumulative Preferred  Share of Beneficial Interest Series H,$26.99,0.03,0.111%,,United States,,35512,,
PSA^I,Public Storage Depositary Shares Each Representing 1/1000 of a 4.875% Cumulative Preferred Share of Beneficial Interest Series I par value $0.01 per share,$26.38,-0.11,-0.415%,,United States,,3389,,
PSA^J,Public Storage Depositary Shares Each Representing 1/1000 of a 4.700% Cumulative Preferred Share of Beneficial Interest Series J par value $0.01 per share,$26.09,0.05,0.192%,,United States,,7623,,
PSA^K,Public Storage Depositary Shares Each Representing 1/1000 of a 4.75% Cumulative Preferred Share of Beneficial Interest Series K,$26.1423,-0.0377,-0.144%,,United States,,10352,,
PSA^L,Public Storage Depositary Shares Each Representing 1/1000 of a 4.625% Cumulative Preferred Share of Beneficial Interest Series L par value $0.01 per share,$26.38,0.14,0.534%,,United States,,24281,,
PSA^M,Public Storage Depositary Shares Each Representing 1/1000 of a 4.125% Cumulative Preferred Share of Beneficial Interest Series M,$25.60,-0.01,-0.039%,,United States,,1334,,
PSA^N,Public Storage Depositary Shares Each Representing 1/1000 of a 3.875% Cumulative Preferred Share of Beneficial Interest Series N,$24.94,0.01,0.04%,,United States,,13794,,
PSA^O,Public Storage Depositary Shares Each Representing 1/1000 of a 3.900% Cumulative Preferred Share of Beneficial Interest Series O,$24.7899,0.1499,0.608%,,United States,,24940,,
PSA^P,Public Storage Depositary Shares Each Representing 1/1000 of a 4.000% Cumulative Preferred Share of Bene cial Interest Series P,$24.98,-0.01,-0.04%,,United States,,77270,,
PSA^Q,Public Storage Depositary Shares Each Representing 1/1000 of a 3.950% Cumulative Preferred Share of Beneficial Interest Series Q par value $0.01 per share,$24.75,0.08,0.324%,,United States,,33528,,
PSA^R,Public Storage Depositary Shares Each Representing 1/1000 of a 4.00% Cumulative Preferred Share of Bene cial Interest Series R,$24.94,-0.03,-0.12%,,United States,,43749,,
PSB,PS Business Parks Inc. (MD) Common Stock,$180.65,-2.11,-1.155%,4977014987.00,United States,,66723,Consumer Services,Real Estate Investment Trusts
PSB^X,PS Business Parks Inc. Depositary Shares Each Representing 1/1000 of a Share of 5.25% Cumulative Preferred Stock Series X,$25.55,-0.12,-0.467%,,United States,,5936,,
PSB^Y,PS Business Parks Inc. 5.20% Cumulative Preferred Stock Series Y,$25.6698,-0.1202,-0.466%,,United States,,2603,,
PSB^Z,PS Business Parks Inc. Depositary Shares Each Representing 1/1000 of a Share of 4.875% Cumulative Preferred Stock Series Z  par value $0.01 per share,$26.6861,-0.0539,-0.202%,,United States,,5778,,
PSEC^A,Prospect Capital Corporation 5.35% Series A Fixed Rate Cumulative Perpetual Preferred Stock,$21.27,-0.0513,-0.241%,,United States,,124354,,
PSF,Cohen & Steers Select Preferred and Income Fund Inc. Common Stock,$27.03,0.14,0.521%,324883517.00,,2010,27909,Finance,Investment Managers
PSFE,Paysafe Limited Common Shares,$4.07,0.21,5.44%,2945509395.00,,2021,10229093,Miscellaneous,Business Services
PSN,Parsons Corporation Common Stock,$33.76,0.19,0.566%,3452222653.00,,2019,246612,Capital Goods,Industrial Machinery/Components
PSO,Pearson Plc Common Stock,$8.19,0.06,0.738%,6198064596.00,United Kingdom,,324394,Consumer Services,Books
PSPC,Post Holdings Partnering Corporation Series A Common Stock,$9.70,-0.02,-0.206%,428885500.00,,2021,32508,,
PSTG,Pure Storage Inc. Class A Common Stock,$33.34,0.38,1.153%,9666836447.00,,2015,4941942,Technology,Electronic Components
PSTH,Pershing Square Tontine Holdings Ltd. Class A Common Stock,$19.74,0.01,0.051%,3948001974.00,,2020,725513,,
PSTL,Postal Realty Trust Inc. Class A Common Stock,$18.59,0.16,0.868%,345711277.00,,2019,203756,Consumer Services,Real Estate Investment Trusts
PSX,Phillips 66 Common Stock,$71.90,0.28,0.391%,31506726748.00,United States,,2970139,Energy,Integrated oil Companies
PSXP,Phillips 66 Partners LP Common Units representing limited partner interest in the Partnership,$35.98,0.13,0.363%,8215678453.00,United States,2013,749772,Energy,Oil & Gas Production
PTA,Cohen & Steers Tax-Advantaged Preferred Securities and Income Fund Common Shares of Beneficial Interest,$24.19,0.02,0.083%,1337064925.00,,2020,175225,Finance,Trusts Except Educational Religious and Charitable
PTR,PetroChina Company Limited Common Stock,$44.56,0.56,1.273%,81554147708.00,China,,97677,Energy,Oil & Gas Production
PTY,Pimco Corporate & Income Opportunity Fund,$16.62,0.13,0.788%,1896508200.00,United States,2002,524750,Finance,Investment Managers
PUK,Prudential Public Limited Company Common Stock,$33.95,0.18,0.533%,46620325129.00,United Kingdom,,265617,Finance,Life Insurance
PUK^,Prudential Public Limited Company 6.75% Perpetual Subordinated Captial Security,$25.01,0.01,0.04%,,United Kingdom,,11651,,
PUK^A,Prudential Public Limited Company 6.50% Perpetual Subordinated Capital Securities Exchangeable at the Issuer's Option Into Non-Cumulative Dollar Denominated Preference Shares,$25.02,0.02,0.08%,,United Kingdom,,11114,,
PUMP,ProPetro Holding Corp. Common Stock,$8.45,0.13,1.563%,873487612.00,United States,2017,475813,Energy,Oilfield Services/Equipment
PV,Primavera Capital Acquisition Corporation Class A Ordinary Shares,$9.73,-0.01,-0.103%,522987500.00,,2021,5722,Finance,Business Services
PVG,Pretium Resources Inc. Ordinary Shares (Canada),$13.96,0.09,0.649%,2623056904.00,Canada,,697680,Basic Industries,Precious Metals
PVH,PVH Corp. Common Stock,$100.33,1.75,1.775%,7159521711.00,United States,,663814,,
PVL,Permianville Royalty Trust Trust Units ,$2.15,0.01,0.467%,70950000.00,United States,2011,41305,Energy,Oil & Gas Production
PWR,Quanta Services Inc. Common Stock,$111.88,0.36,0.323%,15942819446.00,United States,,493092,Capital Goods,Engineering & Construction
PWSC,PowerSchool Holdings Inc. Class A Common Stock,$17.24,-0.11,-0.634%,3420447584.00,,2021,453435,Technology,Computer Software: Prepackaged Software
PX,P10 Inc. Class A Common Stock,$12.60,0.18,1.449%,1476160510.00,,2021,228556,Finance,Investment Managers
PXD,Pioneer Natural Resources Company Common Stock,$180.03,-0.97,-0.536%,43951390191.00,United States,,913371,Energy,Oil & Gas Production
PYN,PIMCO New York Municipal Income Fund III Common Shares of Beneficial Interest,$9.35,0.02,0.214%,53612909.00,United States,2002,18691,Finance,Investment Managers
PYS,Merrill Lynch Depositor Inc PPlus Tr Ser RRD-1 Tr Ctf Cl A,$24.18,0.08,0.332%,0.00,United States,,1161,Finance,Trusts Except Educational Religious and Charitable
PYT,PPlus Tr GSC-2 Tr Ctf Fltg Rate,$24.625,0.00,0.00%,0.00,United States,,2176,,
PZC,PIMCO California Municipal Income Fund III Common Shares of Beneficial Interest,$10.82,0.04,0.371%,242508314.00,United States,2002,107675,Finance,Investment Managers
PZN,Pzena Investment Management Inc Class A Common Stock,$9.57,-0.03,-0.313%,690681159.00,United States,2007,45489,Finance,Investment Managers
QD,Qudian Inc. American Depositary Shares each representing one Class A Ordinary Share,$1.01,0.07,7.447%,255619080.00,China,2017,1255145,Technology,Computer Software: Prepackaged Software
QFTA,Quantum FinTech Acquisition Corporation Common Stock,$9.85,0.00,0.00%,247789063.00,,2021,4205,,
QGEN,Qiagen N.V. Common Shares ,$55.26,-0.23,-0.414%,12562587360.00,Netherlands,,212458,Health Care,Biotechnology: Biological Products (No Diagnostic Substances)
QS,QuantumScape Corporation Class A Common Stock,$24.57,0.33,1.361%,10383181263.00,United States,2020,6444264,Capital Goods,Auto Parts:O.E.M.
QSR,Restaurant Brands International Inc. Common Shares,$59.31,0.46,0.782%,18686908221.00,Canada,2014,689569,,
QTWO,Q2 Holdings Inc. Common Stock,$81.88,0.13,0.159%,4652162040.00,,2014,144672,Technology,EDP Services
QUAD,Quad Graphics Inc Class A Common Stock,$3.97,-0.04,-0.998%,216824651.00,United States,,116358,Consumer Services,Recreational Products/Toys
QUOT,Quotient Technology Inc. Common Stock,$7.26,-0.01,-0.138%,685501237.00,,2014,581675,Technology,Advertising
QVCC,QVC Inc. 6.250% Senior Secured Notes due 2068,$25.73,-0.0553,-0.214%,0.00,United States,2019,49578,,
QVCD,QVC Inc. 6.375% Senior Secured Notes due 2067,$25.51,-0.05,-0.196%,0.00,United States,2018,6296,,
R,Ryder System Inc. Common Stock,$79.35,1.09,1.393%,4260560419.00,United States,,231446,Miscellaneous,Rental/Leasing Companies
RA,Brookfield Real Assets Income Fund Inc. Common Stock,$20.82,0.29,1.413%,1038094527.00,,2016,275140,Finance,Investment Managers
RAAS,Cloopen Group Holding Limited American Depositary Shares each representing two Class A Ordinary Shares,$3.27,0.18,5.825%,537490469.00,,2021,1086582,Technology,Computer Software: Prepackaged Software
RACE,Ferrari N.V. Common Shares,$253.46,2.76,1.101%,62652858000.00,,2015,223277,Capital Goods,Auto Manufacturing
RAD,Rite Aid Corporation Common Stock,$13.96,0.11,0.794%,778566831.00,United States,,2734396,Health Care,Medical/Nursing Services
RAMP,LiveRamp Holdings Inc. Common Stock,$48.82,0.99,2.07%,3324306216.00,United States,2018,234636,Technology,EDP Services
RBA,Ritchie Bros. Auctioneers Incorporated Common Stock,$61.25,0.54,0.889%,6771133845.00,Canada,,345051,,
RBAC,RedBall Acquisition Corp. Class A Ordinary Shares,$9.90,-0.03,-0.302%,711562500.00,United States,2020,167080,Finance,Business Services
RBLX,Roblox Corporation Class A Common Stock,$101.82,-0.95,-0.924%,58937045170.00,,2021,9015387,Technology,EDP Services
RBOT,Vicarious Surgical Inc. Class A Common Stock,$11.17,0.99,9.725%,1325026528.00,Hong Kong,2020,615917,Health Care,Medical Specialities
RC,Ready Capital Corproation Common Stock,$15.90,0.11,0.697%,1170140911.00,United States,2013,331648,Consumer Services,Real Estate Investment Trusts
RC^C,Ready Capital Corporation 6.25% Series C Cumulative Convertible Preferred Stock,$25.44,0.00,0.00%,,United States,,3,,
RC^E,Ready Capital Corporation 6.50% Series E Cumulative Redeemable Preferred Stock,$25.2001,0.2001,0.80%,,United States,,12445,,
RCA,Ready Capital Corporation 7.00% Convertible Senior Notes due 2023,$27.07,-0.06,-0.221%,0.00,United States,2017,5019,Consumer Services,Real Estate Investment Trusts
RCB,Ready Capital Corporation 6.20% Senior Notes due 2026,$25.79,-0.07,-0.271%,0.00,United States,2019,1696,,
RCC,Ready Capital Corporation 5.75% Senior Notes due 2026,$25.83,-0.09,-0.347%,0.00,United States,2021,887,Finance,Finance Companies
RCI,Rogers Communication Inc. Common Stock,$46.80,0.15,0.322%,23630504882.00,Canada,,204827,,
RCL,D/B/A Royal Caribbean Cruises Ltd. Common Stock,$79.53,0.07,0.088%,20263436532.00,United States,1993,3858466,,
RCS,PIMCO Strategic Income Fund Inc.,$6.69,0.07,1.057%,297015930.00,United States,1994,204825,Finance,Investment Managers
RCUS,Arcus Biosciences Inc. Common Stock,$44.59,2.78,6.649%,3132424090.00,,2018,729033,Health Care,Biotechnology: Pharmaceutical Preparations
RDN,Radian Group Inc. Common Stock,$20.51,0.20,0.985%,3678122619.00,United States,,1166245,Finance,Property-Casualty Insurers
RDS/B,Royal Dutch Shell PLC,$43.81,0.26,0.597%,,Netherlands,,1943823,,
RDW,Redwire Corporation Common Stock,$7.34,-0.05,-0.677%,437913744.00,United States,2021,451432,Capital Goods,Aerospace
RDY,Dr. Reddy's Laboratories Ltd Common Stock,$62.79,0.67,1.079%,10415948724.00,India,,85518,Health Care,Biotechnology: Pharmaceutical Preparations
RE,Everest Re Group Ltd. Common Stock,$267.02,3.95,1.502%,10512317323.00,Bermuda,,124156,Finance,Property-Casualty Insurers
RELX,RELX PLC PLC American Depositary Shares (Each representing One Ordinary Share),$31.87,0.13,0.41%,61660119214.00,United Kingdom,2015,365596,Consumer Services,Publishing
RENN,Renren Inc. American Depositary Shares each representing fifteen Class A ordinary shares,$14.38,1.88,15.04%,345398339.00,China,2011,260346,Technology,EDP Services
RERE,ATRenew Inc. American Depositary Shares (every three of which representing two Class A ordinary shares),$5.74,0.07,1.235%,1277923959.00,,2021,151474,,
RES,RPC Inc. Common Stock,$4.66,0.00,0.00%,1005280532.00,United States,,358795,Energy,Oilfield Services/Equipment
REV,Revlon Inc. New Common Stock,$11.35,0.03,0.265%,609038412.00,United States,1996,40976,Consumer Non-Durables,Package Goods/Cosmetics
REVG,REV Group Inc. Common Stock,$14.00,-0.07,-0.498%,910294686.00,United States,2017,248776,Capital Goods,Industrial Machinery/Components
